<?xml version="1.0" encoding="UTF-8"?>
<review xmlns="http://plugins.intellij.net/revu"
        xmlns:xsi="http://www.w3.org/2001/XMLSchema-instance"
        xsi:schemaLocation="http://plugins.intellij.net/revu http://plugins.intellij.net/revu/ns/revu_1_0.xsd"
        name="Test review" status="draft" shared="true">
  <history createdBy="u1" lastUpdatedBy="u2" createdOn="2008-01-01T12:00:00" lastUpdatedOn="2008-01-01T12:00:00"/>
  <goal>A test review. A test review. A test review. A test review. A test review.</goal>
  <referential>
    <priorities>
      <priority order="1" name="priority1"/>
      <priority order="2" name="priority2"/>
      <priority order="3" name="priority3"/>
    </priorities>
    <tags>
      <tag name="tag1"/>
      <tag name="tag2"/>
    </tags>
    <users>
      <user displayName="user1" login="u1" password="p1" roles="admin"/>
      <user displayName="user2" login="u2" password="p2" roles="admin,reviewer"/>
      <user displayName="user3" login="u3" password="p3" roles="reviewer,author"/>
    </users>
  </referential>
  <issues>
    <issue summary="Test item review 1" filePath="Test-1.java" lineStart="1" lineEnd="2" hash="1" tags="tag1"
          priority="priority1" status="to_resolve">
      <history createdBy="u2" lastUpdatedBy="u3" createdOn="2008-01-01T12:00:00" lastUpdatedOn="2008-02-02T12:00:00"/>
      <desc>Test item review 1. Test item review 1.</desc>
    </issue>
    <issue summary="Test item review 2" filePath="Test-2.java" lineStart="2" lineEnd="5" hash="1" tags="tag2"
          priority="priority2" status="to_resolve">
      <history createdBy="u3" lastUpdatedBy="u1" createdOn="2008-02-01T12:00:00" lastUpdatedOn="2008-03-02T12:00:00"/>
      <desc>Test item review 2. Test item review 2.</desc>
    </issue>
  </issues>
</review>