<?xml version="1.0" encoding="UTF-8"?>
<review xmlns="http://plugins.intellij.net/revu"
        xmlns:xsi="http://www.w3.org/2001/XMLSchema-instance"
        xsi:schemaLocation="http://plugins.intellij.net/revu http://plugins.intellij.net/xstructure/ns/revu_1_0.xsd"
        name="[Default]" status="_template" shared="true">
  <history createdBy="[default]" lastUpdatedBy="[default]" createdOn="2008-01-01T00:00:00" lastUpdatedOn="2008-01-01T00:00:00"/>
  <goal><![CDATA[Default review provided as a template to extends / copy.

You may use this template when you don't want customize tags or priorities defined by default.

Otherwise, you should create another template suiting your needs]]></goal>
  <referential>
    <priorities>
      <priority order="0" name="low"/>
      <priority order="1" name="normal"/>
      <priority order="2" name="high"/>
    </priorities>
    <tags>
      <tag name="tag1"/>
      <tag name="tag2"/>
    </tags>
  </referential>
</review>